===== SMART con -d sat =====
[sudo] contraseña para pepe: smartctl 7.4 2023-08-01 r5530 [x86_64-linux-6.18.7-76061807-generic] (local build)
Copyright (C) 2002-23, Bruce Allen, Christian Franke, www.smartmontools.org

=== START OF INFORMATION SECTION ===
Device Model:     PNY 250GB SATA SSD
Serial Number:    PNF23244017250307229
LU WWN Device Id: 5 f8db4c 232407229
Firmware Version: W0825A0
User Capacity:    250.059.350.016 bytes [250 GB]
Sector Size:      512 bytes logical/physical
Rotation Rate:    Solid State Device
Form Factor:      2.5 inches
TRIM Command:     Available
Device is:        Not in smartctl database 7.3/5528
ATA Version is:   ACS-2 T13/2015-D revision 3
SATA Version is:  SATA 3.2, 6.0 Gb/s (current: 6.0 Gb/s)
Local Time is:    Mon Jun 15 07:59:25 2026 -05
SMART support is: Available - device has SMART capability.
SMART support is: Enabled

=== START OF READ SMART DATA SECTION ===
SMART Status not supported: Incomplete response, ATA output registers missing
SMART overall-health self-assessment test result: PASSED
Warning: This result is based on an Attribute check.

General SMART Values:
Offline data collection status:  (0x00)	Offline data collection activity
					was never started.
					Auto Offline Data Collection: Disabled.
Self-test execution status:      (   0)	The previous self-test routine completed
					without error or no self-test has ever 
					been run.
Total time to complete Offline 
data collection: 		(  120) seconds.
Offline data collection
capabilities: 			 (0x11) SMART execute Offline immediate.
					No Auto Offline data collection support.
					Suspend Offline collection upon new
					command.
					No Offline surface scan supported.
					Self-test supported.
					No Conveyance Self-test supported.
					No Selective Self-test supported.
SMART capabilities:            (0x0002)	Does not save SMART data before
					entering power-saving mode.
					Supports SMART auto save timer.
Error logging capability:        (0x01)	Error logging supported.
					General Purpose Logging supported.
Short self-test routine 
recommended polling time: 	 (   2) minutes.
Extended self-test routine
recommended polling time: 	 (  10) minutes.
SCT capabilities: 	       (0x0001)	SCT Status supported.

SMART Attributes Data Structure revision number: 1
Vendor Specific SMART Attributes with Thresholds:
ID# ATTRIBUTE_NAME          FLAG     VALUE WORST THRESH TYPE      UPDATED  WHEN_FAILED RAW_VALUE
  1 Raw_Read_Error_Rate     0x0032   100   100   050    Old_age   Always       -       0
  5 Reallocated_Sector_Ct   0x0032   100   100   050    Old_age   Always       -       0
  9 Power_On_Hours          0x0032   100   100   050    Old_age   Always       -       4232
 12 Power_Cycle_Count       0x0032   100   100   050    Old_age   Always       -       196
160 Unknown_Attribute       0x0032   100   100   050    Old_age   Always       -       0
161 Unknown_Attribute       0x0033   100   100   050    Pre-fail  Always       -       100
163 Unknown_Attribute       0x0032   100   100   050    Old_age   Always       -       6
164 Unknown_Attribute       0x0032   100   100   050    Old_age   Always       -       31945
165 Unknown_Attribute       0x0032   100   100   050    Old_age   Always       -       229
166 Unknown_Attribute       0x0032   100   100   050    Old_age   Always       -       8
167 Unknown_Attribute       0x0032   100   100   050    Old_age   Always       -       135
168 Unknown_Attribute       0x0032   100   100   050    Old_age   Always       -       3808
169 Unknown_Attribute       0x0032   100   100   050    Old_age   Always       -       97
175 Program_Fail_Count_Chip 0x0032   100   100   050    Old_age   Always       -       0
176 Erase_Fail_Count_Chip   0x0032   100   100   050    Old_age   Always       -       0
177 Wear_Leveling_Count     0x0032   100   100   050    Old_age   Always       -       0
178 Used_Rsvd_Blk_Cnt_Chip  0x0032   100   100   050    Old_age   Always       -       0
181 Program_Fail_Cnt_Total  0x0032   100   100   050    Old_age   Always       -       0
182 Erase_Fail_Count_Total  0x0032   100   100   050    Old_age   Always       -       0
192 Power-Off_Retract_Count 0x0032   100   100   050    Old_age   Always       -       130
194 Temperature_Celsius     0x0022   100   100   050    Old_age   Always       -       40
195 Hardware_ECC_Recovered  0x0032   100   100   050    Old_age   Always       -       0
196 Reallocated_Event_Count 0x0032   100   100   050    Old_age   Always       -       0
197 Current_Pending_Sector  0x0032   100   100   050    Old_age   Always       -       0
198 Offline_Uncorrectable   0x0032   100   100   050    Old_age   Always       -       0
199 UDMA_CRC_Error_Count    0x0032   100   100   050    Old_age   Always       -       0
232 Available_Reservd_Space 0x0032   100   100   050    Old_age   Always       -       100
241 Total_LBAs_Written      0x0030   100   100   050    Old_age   Offline      -       285042
242 Total_LBAs_Read         0x0030   100   100   050    Old_age   Offline      -       1304987
245 Unknown_Attribute       0x0032   100   100   050    Old_age   Always       -       312147

SMART Error Log Version: 1
No Errors Logged

SMART Self-test log structure revision number 1
No self-tests have been logged.  [To run self-tests, use: smartctl -t]

Selective Self-tests/Logging not supported

The above only provides legacy SMART information - try 'smartctl -x' for more


===== DETECCION USB =====
Bus 001 Device 001: ID 1d6b:0002 Linux Foundation 2.0 root hub
Bus 001 Device 002: ID 2109:2822 VIA Labs, Inc. USB2.0 Hub             
Bus 001 Device 003: ID 2109:2822 VIA Labs, Inc. USB2.0 Hub             
Bus 001 Device 004: ID 0e8d:7902 MediaTek Inc. Wireless_Device
Bus 001 Device 005: ID 05d5:6782 Super Gate Technology Co., Ltd USB Keyboard
Bus 001 Device 006: ID 10c4:8105 Silicon Labs USB OPTICAL MOUSE
Bus 002 Device 001: ID 1d6b:0003 Linux Foundation 3.0 root hub
Bus 002 Device 002: ID 2109:0822 VIA Labs, Inc. USB3.1 Hub             
Bus 002 Device 003: ID 2109:0822 VIA Labs, Inc. USB3.1 Hub             
Bus 002 Device 004: ID 7825:a2a4 Other World Computing External SATA Hard Drive Adapter cable PA023U3
Bus 002 Device 005: ID 0bc2:2344 Seagate RSS LLC Portable

===== UDEVADM =====
E: ID_BUS=ata
E: ID_MODEL=PNY_250GB_SATA_SSD
E: ID_MODEL_ENC=PNY\x20250GB\x20SATA\x20SSD\x20\x20\x20\x20\x20\x20\x20\x20\x20\x20\x20\x20\x20\x20\x20\x20\x20\x20\x20\x20\x20\x20
E: ID_USB_MODEL=B_SATA_SSD
E: ID_USB_MODEL_ENC=B\x20SATA\x20SSD\x20\x20\x20\x20\x20\x20
E: ID_USB_MODEL_ID=a2a4
E: ID_USB_SERIAL=PNY_250G_B_SATA_SSD_235678C20B11-0:0
E: ID_USB_SERIAL_SHORT=235678C20B11
E: ID_USB_VENDOR=PNY_250G
E: ID_USB_VENDOR_ENC=PNY\x20250G
E: ID_USB_VENDOR_ID=7825
E: ID_USB_REVISION=4101
E: ID_USB_TYPE=disk
E: ID_USB_INSTANCE=0:0
E: ID_USB_INTERFACES=:080650:080662:
E: ID_USB_INTERFACE_NUM=00
E: ID_USB_DRIVER=uas
E: ID_PATH_WITH_USB_REVISION=pci-0000:00:14.0-usbv3-0:4:1.0-scsi-0:0:0:0
E: ID_PATH=pci-0000:00:14.0-usb-0:4:1.0-scsi-0:0:0:0
E: ID_PATH_TAG=pci-0000_00_14_0-usb-0_4_1_0-scsi-0_0_0_0

===== SYS BLOCK =====
PNY 250G
B SATA SSD      

===== ESPACIO EN / =====
93G	/var/lib
1,3G	/var/log
846M	/var/cache
24M	/var/crash
4,2M	/var/backups
76K	/var/tmp
40K	/var/spool
16K	/var/lock
4,0K	/var/opt
4,0K	/var/mail

--- /var/log ---
999M	/var/log/journal
144M	/var/log/syslog.1
134M	/var/log/kern.log.1
7,1M	/var/log/syslog.2.gz
4,9M	/var/log/syslog.3.gz
4,4M	/var/log/syslog.4.gz
3,9M	/var/log/kern.log.3.gz
3,3M	/var/log/kern.log.2.gz
3,0M	/var/log/kern.log.4.gz
1,3M	/var/log/dpkg.log.1

--- /home/pepe ---
51G	/home/pepe/AI_MODELS_BACKUP
39G	/home/pepe/Wan2GP
7,8G	/home/pepe/comfyui_env
2,3G	/home/pepe/documusic
677M	/home/pepe/_work
614M	/home/pepe/Descargas
594M	/home/pepe/externals.2.335.1
591M	/home/pepe/externals.2.334.0
493M	/home/pepe/ComfyUI
114M	/home/pepe/actions-runner-linux-x64-2.321.0.tar.gz
80M	/home/pepe/bin.2.335.1
80M	/home/pepe/bin.2.334.0
11M	/home/pepe/_diag
32K	/home/pepe/ai-hub-gateway
8,0K	/home/pepe/Vídeos

--- /tmp ---
24K	/tmp/RustDesk
16K	/tmp/tmpcyzzfek8
8,0K	/tmp/systemd-private-62d71e2669e94ad08357b8126d526eeb-upower.service-HGn9ZF
8,0K	/tmp/systemd-private-62d71e2669e94ad08357b8126d526eeb-systemd-resolved.service-7KxAos
8,0K	/tmp/systemd-private-62d71e2669e94ad08357b8126d526eeb-systemd-logind.service-2b6yqV

--- /root ---

--- /opt ---
12K	/opt/containerd
8,0K	/opt/ComfyUI

===== DOCKER =====
TYPE            TOTAL     ACTIVE    SIZE      RECLAIMABLE
Images          13        4         65.29GB   64.58GB (98%)
Containers      4         4         49.91MB   0B (0%)
Local Volumes   0         0         0B        0B
Build Cache     38        0         39.71GB   17.49GB

===== JOURNAL SIZE =====
Archived and active journals take up 998.0M in the file system.

===== SNAP PACKAGES =====

===== APT CACHE =====
796M	/var/cache/apt

===== FSCK CONFIG ACTUAL =====
Last mounted on:          /
Filesystem state:         clean
Last mount time:          Mon Jun 15 07:39:41 2026
Last write time:          Mon Jun 15 07:39:40 2026
Mount count:              1
Maximum mount count:      -1
Last checked:             Mon Jun 15 07:32:13 2026
Check interval:           0 (<none>)
Checksum type:            crc32c
Checksum:                 0x2d4994ef

===== FIN =====
